<?xml version="1.0" encoding="UTF-8"?>
<!--
To change this license header, choose License Headers in Project Properties.
To change this template file, choose Tools | Templates
and open the template in the editor.
-->

<Merchadona
    xmlns:xsi='http://www.w3.org/2001/XMLSchema-instance'
    xsi:noNamespaceSchemaLocation='file:/home/daw/NetBeansProjects/segundotrimestre/XML/public_html/XML/Merchadona/newXmlSchemaMerchadona.xsd'>
    <Empleados>
        <Cajero>
            <Nombre>RONY</Nombre>
            <ID>3</ID>
            <NumeroProductosVendidos>8</NumeroProductosVendidos>
        </Cajero>
        <Reponedor>
            <Nombre>PATRICIO</Nombre>
            <ID>5</ID>
            <NumeroProductosRepuestos>3</NumeroProductosRepuestos>
        </Reponedor>
    </Empleados>
    <Productos>
        <Perecedero>
            <FechaDeReposicion>25/01/199</FechaDeReposicion>
            <PrecioProducto>9</PrecioProducto>
            <NombreProducto>colita</NombreProducto>
        </Perecedero>
        <NoPerecedero>
            <NombreProducto>toto</NombreProducto>
            <PrecioProducto>3</PrecioProducto>
        </NoPerecedero>
    </Productos>

</Merchadona>